{
  "$schema": "https://json-schema.org/draft/2020-12/schema",
  "$id": "urn:tkuft:corpus:2",
  "title": "Tom Klootwijk V2 corpus",
  "type": "object",
  "additionalProperties": false,
  "required": [
    "schema_version",
    "title",
    "author",
    "substrate_id",
    "definitions",
    "instances"
  ],
  "properties": {
    "schema_version": {
      "const": "2.0.0"
    },
    "title": {
      "type": "string"
    },
    "author": {
      "const": {
        "name": "Tom Klootwijk",
        "identifier": "NL200678942",
        "date_of_birth": "10-07-1990"
      }
    },
    "substrate_id": {
      "type": "string"
    },
    "definitions": {
      "type": "array",
      "items": {
        "$schema": "https://json-schema.org/draft/2020-12/schema",
        "$id": "urn:tkuft:definition:2",
        "title": "V2 literal definition",
        "type": "object",
        "additionalProperties": false,
        "required": [
          "id",
          "kind",
          "domain",
          "codomain",
          "evaluation_phase",
          "dependencies",
          "parameters",
          "capabilities",
          "invariants",
          "provenance",
          "content_hash"
        ],
        "properties": {
          "id": {
            "type": "string",
            "minLength": 1
          },
          "kind": {
            "type": "string"
          },
          "domain": {
            "type": "string"
          },
          "codomain": {
            "type": "string"
          },
          "evaluation_phase": {
            "type": "integer",
            "minimum": 0,
            "maximum": 9
          },
          "dependencies": {
            "type": "array",
            "uniqueItems": true,
            "items": {
              "type": "string"
            }
          },
          "parameters": {
            "type": "object"
          },
          "capabilities": {
            "type": "array",
            "items": {
              "type": "string"
            }
          },
          "invariants": {
            "type": "array",
            "items": {
              "type": "string"
            }
          },
          "provenance": {
            "type": "object",
            "required": [
              "origin",
              "source",
              "location"
            ],
            "properties": {
              "origin": {
                "type": "string"
              },
              "source": {
                "type": "string"
              },
              "location": {
                "type": "string"
              }
            }
          },
          "content_hash": {
            "type": "string",
            "pattern": "^sha256:[0-9a-f]{64}$"
          }
        }
      }
    },
    "instances": {
      "type": "array",
      "items": {
        "type": "object",
        "required": [
          "id",
          "definition_ref",
          "literal",
          "state"
        ],
        "properties": {
          "id": {
            "type": "string"
          },
          "definition_ref": {
            "type": "string"
          },
          "literal": {},
          "state": {
            "type": "object"
          }
        }
      }
    }
  }
}
