{
  "schema_version": "2.0.0",
  "title": "Tom Klootwijk — Unified Field Theory V2",
  "author": {
    "name": "Tom Klootwijk",
    "identifier": "NL200678942",
    "date_of_birth": "10-07-1990"
  },
  "substrate_id": "tkuft:uu-id:v2",
  "definitions": [
    {
      "id": "base:author",
      "kind": "literal_author",
      "domain": "literal",
      "codomain": "author_record",
      "evaluation_phase": 0,
      "dependencies": [],
      "parameters": {
        "name": "Tom Klootwijk",
        "identifier": "NL200678942",
        "date_of_birth": "10-07-1990"
      },
      "capabilities": [],
      "invariants": [],
      "provenance": {
        "origin": "v2-binding",
        "source": "user",
        "location": "V2 request"
      },
      "content_hash": "sha256:b3b94d9af46a2b8ec1be0165e553477b06f87004fd46de024a39538579d9766b"
    },
    {
      "id": "base:number",
      "kind": "literal_integer",
      "domain": "literal",
      "codomain": "integer[0,99]",
      "evaluation_phase": 0,
      "dependencies": [],
      "parameters": {},
      "capabilities": [],
      "invariants": [],
      "provenance": {
        "origin": "v2-binding",
        "source": "S1",
        "location": "§3.2"
      },
      "content_hash": "sha256:d3e05d4c722eaeb35cba5389f3130e43d46cb448521d5d46858883635ef1bfa6"
    },
    {
      "id": "base:radix",
      "kind": "radix_encode",
      "domain": "nonnegative_integer",
      "codomain": "radix_word",
      "evaluation_phase": 1,
      "dependencies": [
        "base:number"
      ],
      "parameters": {
        "base": 2
      },
      "capabilities": [],
      "invariants": [],
      "provenance": {
        "origin": "v2-binding",
        "source": "S1",
        "location": "§4.2"
      },
      "content_hash": "sha256:d5a5634aa82811a7d1a048290e3c1d4f5c87d2cb7437165b7e1179290dd106e7"
    },
    {
      "id": "base:active",
      "kind": "active_bit_filter",
      "domain": "nonnegative_integer",
      "codomain": "active_bit_set",
      "evaluation_phase": 3,
      "dependencies": [
        "base:radix"
      ],
      "parameters": {},
      "capabilities": [],
      "invariants": [],
      "provenance": {
        "origin": "v2-binding",
        "source": "S1",
        "location": "§6.3"
      },
      "content_hash": "sha256:d89a9c610e31b2e3879f33cc62b9ef3894f5b89e1645fa6116ebf4db3abab619"
    },
    {
      "id": "base:dutch",
      "kind": "language_profile",
      "domain": "integer[0,99]",
      "codomain": "lexeme_record",
      "evaluation_phase": 3,
      "dependencies": [
        "base:number"
      ],
      "parameters": {
        "data": "data/dutch_profile_0_99.json"
      },
      "capabilities": [],
      "invariants": [],
      "provenance": {
        "origin": "v2-binding",
        "source": "S1",
        "location": "§6"
      },
      "content_hash": "sha256:99cb9e2fc22f587ece552fb3947b475ba65583c6ff8b178ce78da63886f78053"
    },
    {
      "id": "base:pulses",
      "kind": "pulse_projection",
      "domain": "lexeme_record",
      "codomain": "pulse_sequence",
      "evaluation_phase": 3,
      "dependencies": [
        "base:dutch"
      ],
      "parameters": {},
      "capabilities": [],
      "invariants": [],
      "provenance": {
        "origin": "v2-binding",
        "source": "S1",
        "location": "§6.3"
      },
      "content_hash": "sha256:7319541f6f9d6906144e45101d9f82caa168f9f6406016d1f74794df9af81365"
    },
    {
      "id": "base:polygon",
      "kind": "pulse_polygon",
      "domain": "positive_count",
      "codomain": "ordered_vertices",
      "evaluation_phase": 3,
      "dependencies": [
        "base:pulses"
      ],
      "parameters": {
        "radius": 1,
        "phase": 0
      },
      "capabilities": [],
      "invariants": [],
      "provenance": {
        "origin": "v2-binding",
        "source": "S1",
        "location": "§4.3"
      },
      "content_hash": "sha256:5d56183fad8eade401c75a3002278c5b0d552d59eb8938f26030c2965d0e04e7"
    },
    {
      "id": "base:count",
      "kind": "count_comparison",
      "domain": "feature_pair",
      "codomain": "boolean",
      "evaluation_phase": 4,
      "dependencies": [
        "base:active",
        "base:pulses"
      ],
      "parameters": {},
      "capabilities": [],
      "invariants": [],
      "provenance": {
        "origin": "v2-binding",
        "source": "S1",
        "location": "§6.3"
      },
      "content_hash": "sha256:f04261da558ddce6fdf7ca95e080ae984991e8e51597548bbd86b41ff13e8a4a"
    },
    {
      "id": "base:hinge",
      "kind": "connector_hinge",
      "domain": "place_chart",
      "codomain": "spoken_chart",
      "evaluation_phase": 4,
      "dependencies": [
        "base:dutch"
      ],
      "parameters": {
        "connector": "en",
        "value": 0
      },
      "capabilities": [],
      "invariants": [],
      "provenance": {
        "origin": "v2-binding",
        "source": "S1",
        "location": "§6.2"
      },
      "content_hash": "sha256:0f768ee4722aced341a29f6ac49d7627219353db3fba3caec7757445e8a983c6"
    },
    {
      "id": "base:wrap",
      "kind": "orientation_wrap",
      "domain": "boundary_port",
      "codomain": "boundary_port",
      "evaluation_phase": 4,
      "dependencies": [],
      "parameters": {
        "orientation_multiplier": -1
      },
      "capabilities": [],
      "invariants": [],
      "provenance": {
        "origin": "v2-binding",
        "source": "S1",
        "location": "§5.1"
      },
      "content_hash": "sha256:dab869cb5bd306e3bf51d2c2e9f1951cca5c2c5f7e79981fb86ceb44dd7b7a6c"
    },
    {
      "id": "base:guard",
      "kind": "root_relation",
      "domain": "field_trajectory",
      "codomain": "event_candidates",
      "evaluation_phase": 7,
      "dependencies": [],
      "parameters": {},
      "capabilities": [],
      "invariants": [],
      "provenance": {
        "origin": "v2-binding",
        "source": "S1",
        "location": "§7.2"
      },
      "content_hash": "sha256:c0624eac28af0081b8a1cbc55dd8486771c0072c27cf2af7f0ccca0061b7fe1b"
    },
    {
      "id": "base:schedule",
      "kind": "phase_schedule",
      "domain": "definitions",
      "codomain": "ordered_stages",
      "evaluation_phase": 2,
      "dependencies": [],
      "parameters": {
        "phases": [
          "parse",
          "normalize",
          "resolve",
          "construct",
          "transform",
          "support",
          "compatibility",
          "guard",
          "transition",
          "lineage"
        ]
      },
      "capabilities": [],
      "invariants": [],
      "provenance": {
        "origin": "v2-binding",
        "source": "S1",
        "location": "§7.3"
      },
      "content_hash": "sha256:8b095fa5f3304300933f14bb48caffa930e78a8d461b8cd56aed829f40573f27"
    },
    {
      "id": "base:seed",
      "kind": "frozen_seed",
      "domain": "fixture_parameters",
      "codomain": "seed",
      "evaluation_phase": 3,
      "dependencies": [],
      "parameters": {
        "A": 32,
        "R": 2,
        "G": 2,
        "fixture": "TKUFT-integer-chart-v2"
      },
      "capabilities": [],
      "invariants": [],
      "provenance": {
        "origin": "v2-binding",
        "source": "V2",
        "location": "explicit demonstration"
      },
      "content_hash": "sha256:9a2f27f8adbeb425e4efb75694aceb9eacb0889320bae7cfe92b9211454eb1e6"
    },
    {
      "id": "base:sample",
      "kind": "field_sample",
      "domain": "seed_and_state",
      "codomain": "sample_array",
      "evaluation_phase": 3,
      "dependencies": [
        "base:seed"
      ],
      "parameters": {},
      "capabilities": [],
      "invariants": [],
      "provenance": {
        "origin": "v2-binding",
        "source": "S2",
        "location": "§3.1"
      },
      "content_hash": "sha256:057b16ada4391dc5781fe553c5d5e1cd32d4ce6266bdb96d325ebea04e3b1320"
    },
    {
      "id": "base:support",
      "kind": "edge_support",
      "domain": "sample_array",
      "codomain": "active_edges",
      "evaluation_phase": 5,
      "dependencies": [
        "base:sample"
      ],
      "parameters": {},
      "capabilities": [],
      "invariants": [],
      "provenance": {
        "origin": "v2-binding",
        "source": "S2",
        "location": "§3.2"
      },
      "content_hash": "sha256:40b509656f441d41947ba26c29729e919c8072937cef3f2c10484c85280ee936"
    },
    {
      "id": "base:transition",
      "kind": "atomic_transition",
      "domain": "admitted_state",
      "codomain": "admitted_state",
      "evaluation_phase": 8,
      "dependencies": [
        "base:support"
      ],
      "parameters": {},
      "capabilities": [],
      "invariants": [],
      "provenance": {
        "origin": "v2-binding",
        "source": "S2",
        "location": "§3"
      },
      "content_hash": "sha256:297e6070971332df92099acf2a9905e2f8e0fe35b620e14248b6c0932ef7f9ac"
    },
    {
      "id": "base:word",
      "kind": "binary_encoding",
      "domain": "admitted_state",
      "codomain": "binary_word",
      "evaluation_phase": 9,
      "dependencies": [
        "base:transition"
      ],
      "parameters": {
        "cell_widths": [
          32,
          32,
          17,
          17,
          16,
          4
        ],
        "control_widths": [
          11,
          3,
          13
        ]
      },
      "capabilities": [],
      "invariants": [],
      "provenance": {
        "origin": "v2-binding",
        "source": "S2",
        "location": "C11"
      },
      "content_hash": "sha256:8395b8d77ffdbd53dacca7352e90470c7367ef35f28484c5ec5a35ebf9331118"
    },
    {
      "id": "base:signed-state",
      "kind": "signed_state_field",
      "domain": "binary_word",
      "codomain": "signed_distance_R1",
      "evaluation_phase": 9,
      "dependencies": [
        "base:word"
      ],
      "parameters": {
        "spacing": 3,
        "radius": 0.25,
        "anchor": 0
      },